{"config_sha256":"778591657cd2b4d7b946778a81efcd413eda4827b2aeecc56b57637fe914d21e","contract":"typaxis.contract/1.2","data_versions":{"japanese_line_break":"typaxis-jlreq-horizontal/1.0.0","shaper_backend":"typaxis-reference-shaper","shaper_version":"0.1.0","unicode":"16.0.0"},"deterministic":true,"engine":{"git_commit":null,"name":"typaxis","rust_version":"rustc 1.96.1 (31fca3adb 2026-06-26)","version":"0.1.0"},"fonts":[],"images":[],"input_profile":"typaxis.reference-source/1","inputs":[{"bytes":1,"sha256":"01ba4719c80b6fe911b091a7c05124b64eeece964e09c058ef8f9805daca546b","uri":"empty.tsf"}],"layout":{"fallback_policy":null,"final_fingerprint":"b96de394781464968c4f9d05e22416d33bcf23c9610c3e1b5e339cd9e73ca7ae","flow_registry_sha256":null,"pass_count":2,"profile_receipt_sha256":null,"selected_state":2,"status":"converged"},"output":{"bytes":512,"page_count":1,"pdf_object_count":4,"sha256":"01bdd2e1b730cab33456b08582ec237ef155ad90f33ca5d1731a9132adb48e8e","sink":"file"},"package_input":null,"pdf_profile":"pdf-1.7-classic-xref","status":"built","stream_compression":"flate"}